voice,text,pitch,rate,gender
es-ES-AlvaroNeural,rangierfahrt von Gleis sieben neun  via zulu vier nach Gleis drei drei null,medium,slow,Male
de-DE-KillianNeural,umstellmanöver von  alpha sechs  via juliett sieben ins  sierra sieben,medium,medium,Male
fr-FR-JeromeNeural,umstellmanöver vom  charlie sechs  nach  foxtrot drei,low,medium,Male
fr-FR-YvesNeural,umstellmanöver vom  charlie acht  via foxtrot acht nach  echo sechs neun,low,medium,Male
de-DE-ChristophNeural,rangierfahrt vom Gleis neun null sieben  nach Gleis tango sechs,low,medium,Male
de-CH-JanNeural,umstellmanöver von Gleis victor acht neun  nach Gleis juliett acht,medium,medium,Male
de-AT-JonasNeural,umstellmanöver vom  romeo fünf  nach  papa fünf,low,medium,Male
de-DE-BerndNeural,rangierfahrt vom Gleis mike drei neun  ins Gleis victor acht,low,medium,Male
de-DE-BerndNeural,umstellmanöver vom Gleis zulu fünf  via tango sieben null nach Gleis zulu zwei null,low,medium,Male
de-DE-ChristophNeural,rangierfahrt von  romeo eins  nach  oscar zwei eins,low,medium,Male
de-DE-ConradNeural,rangierfahrt von Gleis foxtrot sechs  nach Gleis tango acht,low,medium,Male
en-US-BrandonNeural,umstellmanöver von  tango acht  via vier sechs sieben nach  juliett fünf,medium,medium,Male
de-DE-RalfNeural,rangierfahrt von Gleis sechs sechs drei  via vier eins drei nach Gleis papa fünf,low,slow,Male
de-DE-BerndNeural,umstellmanöver vom  juliett drei  via sierra drei nach  drei sechs sieben,medium,slow,Male
de-DE-KillianNeural,rangierfahrt von  fünf vier drei  nach  x-ray sechs acht,medium,medium,Male
fr-FR-HenriNeural,umstellmanöver von Gleis sechs sieben  nach Gleis alpha acht,medium,slow,Male
es-ES-DarioNeural,umstellmanöver vom Gleis vier zwei eins  nach Gleis zulu acht,medium,medium,Male
fr-FR-YvesNeural,rangierfahrt vom Gleis whiskey zwei  via echo drei nach Gleis uniform drei,low,slow,Male
de-DE-BerndNeural,rangierfahrt vom Gleis quebec sieben  nach Gleis drei sieben null,low,medium,Male
de-DE-KasperNeural,umstellmanöver von  kilo sieben null  ins  sechs eins fünf,low,medium,Male
de-DE-BerndNeural,rangierfahrt von Gleis quebec eins  via uniform eins nach Gleis zulu eins,low,slow,Male
de-CH-JanNeural,rangierfahrt vom Gleis eins neun acht  via india zwei nach Gleis whiskey acht,low,medium,Male
de-DE-BerndNeural,rangierfahrt vom  drei eins sechs  via charlie vier acht nach  hotel drei drei,medium,medium,Male
de-DE-KillianNeural,rangierfahrt von  hotel fünf  via november neun nach  juliett fünf,medium,medium,Male
de-CH-JanNeural,rangierfahrt vom  sierra fünf  via bravo drei ins  yankee fünf,medium,medium,Male
fr-FR-HenriNeural,rangierfahrt von Gleis romeo drei  via quebec zwei sieben nach Gleis zwei neun,low,slow,Male
de-DE-ChristophNeural,umstellmanöver vom Gleis foxtrot vier fünf  via vier eins null ins Gleis juliett neun,low,slow,Male
de-DE-ChristophNeural,rangierfahrt von  alpha vier sieben  nach  uniform drei,medium,medium,Male
ta-IN-ValluvarNeural,umstellmanöver vom Gleis bravo fünf  via sechs fünf drei nach Gleis juliett sieben,medium,slow,Male
de-DE-BerndNeural,rangierfahrt von Gleis romeo drei  via quebec zwei sieben nach Gleis zwei neun,medium,slow,Male
de-DE-KlausNeural,umstellmanöver von Gleis echo eins  nach Gleis golf fünf zwei,medium,slow,Male
de-CH-JanNeural,rangierfahrt vom Gleis sieben zwei sechs  nach Gleis sieben neun sieben,low,medium,Male
de-DE-RalfNeural,umstellmanöver von  hotel sieben  nach  zulu sieben null,low,medium,Male
de-DE-KasperNeural,umstellmanöver von  fünf fünf vier  nach  kilo neun,low,slow,Male
de-AT-JonasNeural,rangierfahrt vom Gleis india neun  ins Gleis juliett sieben,low,slow,Male
de-DE-ConradNeural,umstellmanöver von  drei neun acht  nach  lima zwei,medium,medium,Male
pt-PT-DuarteNeural,rangierfahrt von  echo sechs  ins  lima sechs null,low,slow,Male
de-DE-KlausNeural,rangierfahrt von Gleis victor eins sieben  via zwei fünf sechs nach Gleis yankee fünf,low,medium,Male
de-DE-ConradNeural,rangierfahrt von Gleis vier zwei  via zwei neun drei ins Gleis sieben eins sechs,low,medium,Male
de-AT-JonasNeural,rangierfahrt von Gleis delta neun  nach Gleis tango sieben drei,low,slow,Male
de-DE-BerndNeural,rangierfahrt von  victor eins  nach  fünf sechs acht,low,medium,Male
fr-FR-MauriceNeural,umstellmanöver von  mike sieben  nach  india sieben,low,slow,Male
ta-IN-ValluvarNeural,rangierfahrt von Gleis uniform vier vier  via golf acht acht ins Gleis echo zwei,medium,slow,Male
fr-FR-HenriNeural,rangierfahrt von Gleis golf acht  ins Gleis vier sechs fünf,medium,medium,Male
de-DE-KillianNeural,umstellmanöver von Gleis sieben null  via oscar fünf nach Gleis drei sechs acht,medium,medium,Male
de-DE-RalfNeural,umstellmanöver von  charlie drei  nach  vier eins acht,low,slow,Male
ar-EG-ShakirNeural,rangierfahrt vom Gleis hotel drei  nach Gleis quebec drei,medium,medium,Male
de-DE-KlausNeural,umstellmanöver von  whiskey vier  nach  quebec sechs,medium,slow,Male
fr-FR-AlainNeural,rangierfahrt von  charlie zwei zwei  nach  quebec eins,low,medium,Male
de-DE-ConradNeural,umstellmanöver vom  bravo fünf  via delta sechs ins  zulu acht,medium,medium,Male
de-DE-ChristophNeural,umstellmanöver von  hotel drei  via x-ray sechs ins  whiskey neun,low,slow,Male
de-DE-KlausNeural,umstellmanöver vom  india drei vier  via november acht sieben nach  zwei null sechs,low,slow,Male
de-DE-KlausNeural,umstellmanöver vom Gleis foxtrot fünf  via uniform sechs vier ins Gleis sierra eins vier,low,slow,Male
ta-IN-ValluvarNeural,umstellmanöver von Gleis india vier  via delta vier nach Gleis oscar sieben,medium,slow,Male
de-DE-BerndNeural,umstellmanöver von  zwei null null  via papa sieben nach  mike vier,medium,medium,Male
it-IT-BenignoNeural,umstellmanöver von  victor vier  via fünf acht fünf nach  echo fünf null,medium,medium,Male
ta-IN-ValluvarNeural,rangierfahrt von  lima sechs  nach  tango eins,low,medium,Male
en-US-DavisNeural,umstellmanöver von Gleis victor drei  nach Gleis eins neun acht,medium,medium,Male
en-US-GuyNeural,rangierfahrt von  neun acht vier  via zulu neun ins  kilo drei fünf,medium,medium,Male
de-DE-RalfNeural,rangierfahrt von Gleis victor zwei  via x-ray vier ins Gleis kilo eins,medium,medium,Male
it-IT-CalimeroNeural,rangierfahrt von  zulu sieben  ins  sierra sechs vier,low,medium,Male
de-AT-JonasNeural,rangierfahrt von  drei neun zwei  nach  golf vier,low,slow,Male
de-DE-RalfNeural,rangierfahrt vom  foxtrot sechs  nach  juliett zwei eins,medium,slow,Male
fr-FR-JeromeNeural,umstellmanöver vom Gleis echo neun  nach Gleis november neun,medium,slow,Male
fr-FR-HenriNeural,umstellmanöver von Gleis sierra vier drei  nach Gleis acht acht neun,medium,slow,Male
de-DE-RalfNeural,umstellmanöver vom Gleis sieben null eins  nach Gleis romeo zwei,medium,slow,Male
de-DE-KlausNeural,umstellmanöver von  zulu eins  via delta vier vier ins  mike drei,low,medium,Male
de-AT-JonasNeural,umstellmanöver von Gleis november zwei sieben  nach Gleis foxtrot vier,medium,slow,Male
de-CH-JanNeural,umstellmanöver von  lima neun null  nach  victor sechs,medium,medium,Male
de-DE-KasperNeural,rangierfahrt von Gleis acht neun neun  nach Gleis eins sechs,medium,slow,Male
de-DE-ConradNeural,umstellmanöver von  bravo zwei  nach  alpha fünf,low,medium,Male
fr-FR-YvesNeural,umstellmanöver von Gleis delta sechs  via foxtrot eins nach Gleis romeo sieben,medium,medium,Male
de-DE-KillianNeural,rangierfahrt von Gleis uniform sechs  via foxtrot sechs null nach Gleis juliett drei,medium,medium,Male
de-DE-KillianNeural,umstellmanöver vom Gleis charlie eins  ins Gleis vier zwei,medium,slow,Male
es-ES-AlvaroNeural,rangierfahrt von  echo fünf  nach  eins drei fünf,medium,slow,Male
de-DE-KillianNeural,rangierfahrt von Gleis zulu sechs  via hotel drei nach Gleis neun null null,medium,slow,Male
de-DE-ConradNeural,rangierfahrt von Gleis charlie fünf  nach Gleis neun drei sieben,low,slow,Male
de-DE-KillianNeural,rangierfahrt von Gleis quebec drei  via echo sieben nach Gleis eins eins eins,medium,slow,Male
de-DE-KlausNeural,umstellmanöver von Gleis quebec neun null  via tango zwei sechs nach Gleis sechs vier acht,low,slow,Male
de-DE-KasperNeural,umstellmanöver vom  alpha zwei sieben  via quebec eins nach  acht sechs null,medium,medium,Male
de-CH-JanNeural,rangierfahrt vom  hotel drei drei  via oscar fünf sechs nach  drei eins eins,medium,slow,Male
de-DE-KillianNeural,rangierfahrt von  sierra vier zwei  via uniform vier nach  papa neun neun,low,medium,Male
de-AT-JonasNeural,umstellmanöver vom  lima acht zwei  nach  sieben null sieben,medium,medium,Male
de-DE-RalfNeural,rangierfahrt von  mike neun  nach  whiskey acht,medium,medium,Male
it-IT-LisandroNeural,umstellmanöver von  tango sechs vier  nach  neun eins sechs,low,medium,Male
pt-PT-DuarteNeural,umstellmanöver vom  fünf acht drei  via neun acht null nach  fünf sechs vier,medium,medium,Male
de-DE-ConradNeural,rangierfahrt vom Gleis alpha sieben  via drei zwei vier nach Gleis india sieben,medium,slow,Male
de-DE-KasperNeural,rangierfahrt von Gleis bravo fünf eins  ins Gleis charlie vier eins,low,slow,Male
de-DE-BerndNeural,rangierfahrt von Gleis lima drei acht  ins Gleis zulu eins,medium,medium,Male
de-DE-KlausNeural,rangierfahrt vom Gleis sechs sechs null  via alpha eins ins Gleis zulu sechs acht,low,medium,Male
de-DE-ChristophNeural,umstellmanöver von Gleis whiskey fünf sechs  ins Gleis golf vier,medium,medium,Male
de-AT-JonasNeural,rangierfahrt von Gleis zwei zwei vier  nach Gleis x-ray zwei neun,medium,slow,Male
it-IT-DiegoNeural,rangierfahrt von Gleis yankee vier fünf  via tango neun sieben nach Gleis hotel vier,medium,slow,Male
de-DE-ConradNeural,rangierfahrt von  x-ray zwei  nach  foxtrot drei eins,low,medium,Male
de-DE-KlausNeural,rangierfahrt von Gleis acht sechs neun  via sieben nach Gleis alpha sechs,medium,medium,Male
fr-FR-MauriceNeural,rangierfahrt von  sierra zwei  nach  november sechs,medium,medium,Male
en-US-TonyNeural,umstellmanöver von Gleis acht vier sieben  nach Gleis fünf sechs fünf,low,medium,Male
de-DE-BerndNeural,rangierfahrt von Gleis drei neun null  nach Gleis victor zwei,low,medium,Male
fr-FR-ClaudeNeural,rangierfahrt von  romeo fünf sechs  nach  vier sechs sieben,medium,medium,Male
de-DE-KasperNeural,umstellmanöver von Gleis quebec vier sieben  via zulu drei nach Gleis whiskey sieben,low,medium,Male
de-DE-ChristophNeural,rangierfahrt von  juliett zwei  nach  lima drei eins,low,medium,Male
it-IT-BenignoNeural,rangierfahrt von Gleis golf vier  via whiskey fünf nach Gleis alpha vier drei,medium,slow,Male
de-AT-JonasNeural,rangierfahrt von  sechs fünf zwei  ins  zulu sieben,low,slow,Male
de-CH-JanNeural,umstellmanöver von  golf fünf  nach  romeo fünf,medium,slow,Male
fr-FR-YvesNeural,rangierfahrt von  fünf zwei drei  nach  kilo sieben,medium,medium,Male
pt-PT-DuarteNeural,rangierfahrt von  mike sieben zwei  via oscar eins nach  lima sechs,low,slow,Male
de-DE-BerndNeural,rangierfahrt vom  romeo drei  via neun sechs acht nach  india drei,low,medium,Male
de-AT-JonasNeural,umstellmanöver vom  lima fünf  via whiskey fünf nach  zwei acht eins,medium,slow,Male
es-ES-NilNeural,rangierfahrt vom Gleis yankee eins  via sierra eins nach Gleis bravo sechs eins,low,medium,Male
de-AT-JonasNeural,umstellmanöver vom Gleis romeo fünf  nach Gleis delta neun drei,medium,slow,Male
de-DE-KlausNeural,umstellmanöver von  delta sieben  ins  lima eins null,medium,medium,Male
de-DE-KasperNeural,rangierfahrt von  eins null  nach  x-ray fünf,low,medium,Male
tr-TR-AhmetNeural,umstellmanöver von  echo neun drei  ins  tango vier,medium,slow,Male
de-DE-BerndNeural,umstellmanöver vom Gleis yankee sechs fünf  nach Gleis fünf sieben sieben,low,medium,Male
de-CH-JanNeural,rangierfahrt von  victor sechs eins  via acht acht neun ins  oscar fünf null,low,medium,Male
it-IT-DiegoNeural,rangierfahrt von Gleis alpha sechs  nach Gleis mike sechs,low,slow,Male
fr-FR-YvesNeural,rangierfahrt vom  alpha acht  via zulu eins null nach  echo neun fünf,low,slow,Male
de-DE-KlausNeural,umstellmanöver von  golf drei neun  nach  mike eins,medium,slow,Male
de-AT-JonasNeural,umstellmanöver von  kilo neun  via golf fünf nach  delta vier acht,medium,medium,Male
de-DE-RalfNeural,rangierfahrt von  juliett sieben sechs  via acht zwei zwei nach  papa sieben,medium,medium,Male
de-DE-ChristophNeural,rangierfahrt von Gleis eins sieben null  via bravo vier fünf nach Gleis zwei vier eins,medium,medium,Male
de-DE-BerndNeural,umstellmanöver von Gleis oscar drei  via golf fünf nach Gleis whiskey acht,low,medium,Male
de-DE-ChristophNeural,rangierfahrt vom  neun eins acht  ins  tango sieben acht,medium,medium,Male
de-DE-ChristophNeural,umstellmanöver vom Gleis quebec eins  via oscar vier acht nach Gleis eins neun neun,low,slow,Male
en-US-RogerNeural,umstellmanöver vom  hotel sieben drei  nach  november fünf,medium,slow,Male
fr-FR-MauriceNeural,umstellmanöver von Gleis sechs null fünf  via sieben neun eins nach Gleis romeo zwei,medium,medium,Male
pt-PT-DuarteNeural,rangierfahrt von Gleis yankee neun  via x-ray sechs sechs nach Gleis yankee sechs zwei,medium,medium,Male
fr-FR-ClaudeNeural,umstellmanöver von  zulu fünf  nach  lima eins null,low,medium,Male
fr-FR-ClaudeNeural,rangierfahrt vom  sechs neun null  via eins acht vier nach  echo fünf,low,slow,Male
de-DE-BerndNeural,rangierfahrt von Gleis alpha neun  nach Gleis x-ray neun,low,slow,Male
de-DE-ConradNeural,rangierfahrt vom Gleis zwei vier null  nach Gleis tango sechs,low,medium,Male
it-IT-GianniNeural,rangierfahrt von Gleis november drei  via alpha neun null nach Gleis lima vier,medium,slow,Male
de-DE-RalfNeural,rangierfahrt von  papa vier  via oscar fünf nach  acht fünf null,low,medium,Male
de-DE-ConradNeural,rangierfahrt von  foxtrot drei  via bravo drei nach  alpha zwei drei,low,slow,Male
fr-FR-YvesNeural,umstellmanöver vom  juliett sieben sieben  nach  romeo drei sieben,medium,medium,Male
de-DE-KasperNeural,umstellmanöver vom Gleis delta eins zwei  nach Gleis bravo sieben eins,medium,slow,Male
pt-PT-DuarteNeural,rangierfahrt von Gleis kilo drei  nach Gleis quebec sieben,medium,medium,Male
de-DE-RalfNeural,umstellmanöver von  fünf vier  via juliett drei nach  mike acht neun,medium,medium,Male
ta-IN-ValluvarNeural,rangierfahrt von Gleis victor vier  nach Gleis alpha vier eins,low,medium,Male
de-DE-BerndNeural,umstellmanöver von Gleis zulu sechs  nach Gleis november drei drei,low,medium,Male
de-CH-JanNeural,umstellmanöver von  charlie drei  via victor sechs fünf ins  zwei sechs,medium,medium,Male
en-US-GuyNeural,rangierfahrt von Gleis oscar neun  nach Gleis acht sechs,low,medium,Male
de-AT-JonasNeural,umstellmanöver vom  alpha vier eins  via uniform sechs nach  hotel sieben,medium,medium,Male
de-DE-BerndNeural,rangierfahrt von Gleis tango fünf sieben  nach Gleis november sieben sieben,medium,slow,Male
de-DE-KlausNeural,rangierfahrt vom Gleis bravo acht  via neun neun null nach Gleis charlie drei,low,slow,Male
de-DE-KasperNeural,umstellmanöver von Gleis charlie sieben vier  via foxtrot sieben ins Gleis fünf null sieben,medium,medium,Male
de-CH-JanNeural,rangierfahrt von Gleis vier zwei acht  via kilo drei sechs nach Gleis neun sieben vier,low,slow,Male
it-IT-GianniNeural,rangierfahrt von Gleis romeo sechs  ins Gleis whiskey neun,medium,medium,Male
de-DE-KasperNeural,umstellmanöver vom  acht zwei eins  ins  acht neun sieben,medium,medium,Male
de-DE-BerndNeural,rangierfahrt von  oscar fünf  via sechs acht neun nach  oscar sechs,low,medium,Male
pt-PT-DuarteNeural,umstellmanöver von Gleis eins fünf fünf  nach Gleis tango sieben vier,medium,medium,Male
de-CH-JanNeural,rangierfahrt von Gleis november sechs  via drei vier neun ins Gleis sechs acht eins,medium,slow,Male
fr-FR-JeromeNeural,umstellmanöver von Gleis tango sechs zwei  nach Gleis charlie neun,medium,slow,Male
ta-IN-ValluvarNeural,rangierfahrt von Gleis quebec fünf neun  nach Gleis bravo vier,medium,slow,Male
fr-FR-ClaudeNeural,rangierfahrt von Gleis india vier  nach Gleis mike drei,low,medium,Male
de-DE-ChristophNeural,umstellmanöver vom Gleis zulu drei  nach Gleis sierra drei,low,slow,Male
de-DE-ChristophNeural,umstellmanöver von Gleis drei eins zwei  via uniform drei nach Gleis vier fünf fünf,low,medium,Male
de-DE-KasperNeural,rangierfahrt von  oscar zwei  ins  quebec acht,medium,slow,Male
en-US-JasonNeural,umstellmanöver von  bravo eins  via uniform acht ins  kilo sechs,low,slow,Male
de-DE-KillianNeural,umstellmanöver von Gleis tango drei fünf  nach Gleis oscar sieben eins,medium,medium,Male
fr-FR-MauriceNeural,umstellmanöver von  zwei sechs fünf  via sierra acht nach  romeo sechs sechs,low,medium,Male
tr-TR-AhmetNeural,umstellmanöver vom Gleis acht fünf fünf  via eins eins sieben nach Gleis golf acht,medium,slow,Male
de-DE-ChristophNeural,rangierfahrt von  neun acht vier  via zulu neun ins  kilo drei fünf,medium,slow,Male
fr-FR-AlainNeural,umstellmanöver von  drei zwei null  via hotel sieben drei nach  oscar sechs,low,medium,Male
de-DE-ChristophNeural,umstellmanöver vom  delta vier  via uniform fünf nach  eins drei null,low,medium,Male
de-DE-KasperNeural,umstellmanöver vom Gleis whiskey neun  nach Gleis zwei acht zwei,low,medium,Male
de-DE-RalfNeural,rangierfahrt vom Gleis papa neun zwei  nach Gleis quebec drei,low,slow,Male
de-DE-ConradNeural,rangierfahrt von  oscar vier  via tango fünf nach  echo fünf,medium,slow,Male
de-DE-BerndNeural,rangierfahrt von Gleis quebec vier acht  nach Gleis mike acht,low,slow,Male
it-IT-CataldoNeural,rangierfahrt vom Gleis sieben zwei zwei  via charlie eins nach Gleis vier null sechs,low,slow,Male
de-DE-ConradNeural,umstellmanöver von  lima drei vier  nach  charlie zwei,medium,medium,Male
it-IT-RinaldoNeural,rangierfahrt von  oscar vier fünf  via alpha vier nach  foxtrot sieben,low,medium,Male
it-IT-CataldoNeural,umstellmanöver von Gleis sechs null vier  nach Gleis sieben acht acht,low,medium,Male
de-DE-ConradNeural,umstellmanöver von Gleis sierra fünf  ins Gleis victor drei null,medium,medium,Male
de-DE-KlausNeural,umstellmanöver vom  tango zwei  via zwei sechs neun ins  uniform drei,medium,medium,Male
de-DE-KillianNeural,umstellmanöver von  mike sechs  via november drei fünf nach  zulu neun,medium,medium,Male
de-AT-JonasNeural,umstellmanöver von  bravo zwei vier  via vier acht fünf nach  zulu vier,low,medium,Male
de-DE-BerndNeural,umstellmanöver von  mike neun vier  nach  drei drei sieben,medium,medium,Male
de-DE-KlausNeural,rangierfahrt vom  golf sieben  via zwei vier neun ins  echo acht,medium,slow,Male
it-IT-LisandroNeural,umstellmanöver von Gleis india fünf  via echo acht sechs nach Gleis bravo zwei,medium,slow,Male
de-DE-KlausNeural,umstellmanöver von Gleis vier vier sieben  nach Gleis acht null eins,low,slow,Male
de-DE-KlausNeural,umstellmanöver von  x-ray neun neun  via zulu drei ins  delta drei,low,slow,Male
de-DE-ChristophNeural,umstellmanöver von  sierra sieben  nach  delta drei,low,slow,Male
de-DE-RalfNeural,rangierfahrt von  drei eins sechs  nach  sechs drei neun,low,medium,Male
de-DE-ConradNeural,umstellmanöver vom  yankee neun acht  nach  victor drei null,low,medium,Male
de-DE-ChristophNeural,umstellmanöver von  yankee neun  via lima acht fünf ins  alpha fünf,low,slow,Male
de-DE-ChristophNeural,umstellmanöver von  foxtrot acht  via yankee fünf drei nach  zulu acht,low,medium,Male
de-DE-KillianNeural,umstellmanöver von Gleis victor zwei zwei  via papa fünf ins Gleis foxtrot drei,medium,slow,Male
de-CH-JanNeural,rangierfahrt von Gleis november vier  ins Gleis juliett sechs,medium,slow,Male
de-DE-KillianNeural,rangierfahrt vom  vier drei  via fünf fünf nach  papa fünf,medium,medium,Male
de-DE-BerndNeural,rangierfahrt von  victor sieben vier  nach  x-ray drei,low,medium,Male
de-DE-ChristophNeural,rangierfahrt vom  fünf sieben drei  via sieben vier eins nach  hotel eins,low,slow,Male
de-AT-JonasNeural,umstellmanöver vom Gleis zulu eins sechs  via sieben sieben drei ins Gleis yankee acht,low,slow,Male
de-CH-JanNeural,umstellmanöver von  alpha acht  nach  vier zwei sieben,low,medium,Male
de-AT-JonasNeural,rangierfahrt von  sierra fünf  nach  sieben sechs neun,low,slow,Male
de-AT-JonasNeural,rangierfahrt von  charlie fünf eins  nach  zulu zwei,medium,slow,Male
de-AT-JonasNeural,umstellmanöver vom  eins fünf neun  ins  oscar drei neun,medium,slow,Male
de-DE-ConradNeural,rangierfahrt von Gleis eins neun fünf  nach Gleis mike neun,low,medium,Male
ta-IN-ValluvarNeural,rangierfahrt von  victor fünf  via sierra eins zwei ins  alpha fünf,low,medium,Male
de-DE-BerndNeural,rangierfahrt von  quebec vier zwei  nach  zwei vier drei,low,medium,Male
es-ES-AlvaroNeural,rangierfahrt vom  bravo drei  via charlie drei ins  romeo sieben neun,low,medium,Male
de-DE-KlausNeural,umstellmanöver von  bravo eins  via eins zwei fünf ins  yankee zwei,low,medium,Male
de-DE-BerndNeural,umstellmanöver von  mike drei  nach  eins zwei vier,low,medium,Male
es-ES-DarioNeural,umstellmanöver von  whiskey sechs  nach  fünf eins fünf,low,medium,Male
de-DE-ChristophNeural,umstellmanöver von Gleis charlie vier  via charlie fünf sieben ins Gleis mike sechs,low,medium,Male
it-IT-GianniNeural,umstellmanöver von Gleis delta vier  via uniform acht null nach Gleis whiskey vier sechs,medium,slow,Male
de-DE-BerndNeural,umstellmanöver von  foxtrot fünf  nach  echo eins,medium,slow,Male
fr-FR-JeromeNeural,rangierfahrt von  kilo acht  via papa drei nach  kilo vier eins,low,slow,Male
de-DE-KlausNeural,umstellmanöver von  zwei null vier  nach  charlie vier null,medium,slow,Male
it-IT-CalimeroNeural,umstellmanöver von  uniform neun  nach  mike sechs,low,slow,Male
de-CH-JanNeural,umstellmanöver vom Gleis mike vier  nach Gleis mike drei,medium,medium,Male
ta-IN-ValluvarNeural,rangierfahrt vom Gleis golf drei  nach Gleis hotel fünf,medium,medium,Male
de-DE-KasperNeural,umstellmanöver vom  bravo vier  via victor zwei zwei nach  papa sechs zwei,medium,slow,Male
it-IT-RinaldoNeural,rangierfahrt von Gleis romeo vier  via uniform neun null nach Gleis oscar sechs,low,medium,Male
de-DE-ConradNeural,umstellmanöver von  romeo acht  via juliett sechs nach  hotel acht acht,medium,medium,Male
de-DE-ConradNeural,umstellmanöver vom  papa sechs  nach  zulu sieben acht,low,slow,Male
de-CH-JanNeural,rangierfahrt von Gleis whiskey neun  via vier acht fünf nach Gleis victor zwei,low,slow,Male
it-IT-RinaldoNeural,umstellmanöver vom Gleis drei null drei  nach Gleis echo neun,low,medium,Male
de-DE-KasperNeural,umstellmanöver von Gleis sechs drei acht  ins Gleis vier vier sieben,medium,medium,Male
it-IT-LisandroNeural,rangierfahrt von Gleis romeo drei  via foxtrot neun null nach Gleis whiskey neun sechs,low,slow,Male
it-IT-BenignoNeural,umstellmanöver von Gleis kilo neun null  nach Gleis echo sieben neun,low,medium,Male
de-AT-JonasNeural,umstellmanöver von Gleis echo fünf eins  via november neun nach Gleis bravo neun neun,medium,medium,Male
de-DE-BerndNeural,rangierfahrt von  echo vier sechs  nach  zwei acht acht,low,slow,Male
ar-EG-ShakirNeural,umstellmanöver von Gleis echo eins sieben  via sierra sechs nach Gleis sierra fünf,low,medium,Male
de-DE-ConradNeural,rangierfahrt vom Gleis charlie neun  via yankee neun zwei nach Gleis drei drei vier,medium,medium,Male
de-CH-JanNeural,rangierfahrt von Gleis tango neun  via zulu sieben ins Gleis vier eins neun,low,slow,Male
fr-FR-ClaudeNeural,umstellmanöver von Gleis uniform vier eins  via acht acht sechs ins Gleis foxtrot eins vier,low,medium,Male
de-AT-JonasNeural,umstellmanöver von Gleis sechs neun sechs  via victor drei nach Gleis mike fünf,low,slow,Male
de-DE-BerndNeural,rangierfahrt vom  quebec zwei  nach  fünf eins sieben,low,slow,Male
fr-FR-YvesNeural,umstellmanöver von  quebec neun  nach  neun sechs drei,medium,medium,Male
de-DE-BerndNeural,umstellmanöver von  november eins sieben  via whiskey vier nach  lima eins sechs,medium,medium,Male
de-DE-ConradNeural,umstellmanöver von Gleis whiskey fünf  nach Gleis sieben sechs,medium,medium,Male
pt-PT-DuarteNeural,rangierfahrt vom  sechs eins fünf  nach  golf sieben,low,medium,Male
de-DE-KasperNeural,rangierfahrt von Gleis uniform neun  nach Gleis tango drei,low,slow,Male
de-DE-RalfNeural,rangierfahrt von Gleis hotel fünf sieben  nach Gleis hotel fünf,low,slow,Male
de-CH-JanNeural,rangierfahrt von Gleis tango drei neun  via sieben sechs fünf nach Gleis golf eins,medium,medium,Male
de-DE-ConradNeural,umstellmanöver von  uniform drei  nach  kilo fünf,medium,medium,Male
fr-FR-ClaudeNeural,rangierfahrt von  november vier  via victor acht nach  echo eins null,medium,medium,Male
it-IT-RinaldoNeural,umstellmanöver vom  victor neun  nach  tango neun acht,low,slow,Male
de-AT-JonasNeural,umstellmanöver vom Gleis fünf fünf neun  via yankee eins sechs nach Gleis quebec zwei,medium,slow,Male
fr-FR-JeromeNeural,umstellmanöver von Gleis foxtrot acht  via golf sieben null nach Gleis oscar sieben neun,low,medium,Male
de-DE-KasperNeural,rangierfahrt von Gleis golf zwei sieben  nach Gleis vier zwei neun,medium,slow,Male
ta-IN-ValluvarNeural,rangierfahrt vom Gleis oscar sieben  via eins vier zwei nach Gleis foxtrot drei,medium,medium,Male
de-CH-JanNeural,umstellmanöver von  vier sechs eins  via acht acht neun nach  golf vier,low,medium,Male
de-DE-KlausNeural,rangierfahrt von Gleis eins fünf sieben  ins Gleis x-ray vier,low,medium,Male
de-DE-BerndNeural,umstellmanöver von  hotel sechs  nach  sechs drei sechs,low,medium,Male
fr-FR-AlainNeural,umstellmanöver von  fünf null drei  via romeo fünf nach  yankee acht,medium,slow,Male
de-CH-JanNeural,umstellmanöver von  zwei vier acht  nach  november sieben drei,medium,slow,Male
