voice,text,pitch,rate,gender
it-IT-GianniNeural,umstellmanöver von Gleis charlie zwei  via foxtrot drei nach Gleis vier zwei sechs,medium,slow,Male
ar-EG-ShakirNeural,umstellmanöver von Gleis whiskey sieben eins  nach Gleis sierra neun,low,slow,Male
fr-FR-YvesNeural,umstellmanöver von Gleis bravo zwei  via delta vier nach Gleis delta eins,medium,slow,Male
de-DE-ChristophNeural,rangierfahrt von Gleis delta neun neun  via golf vier nach Gleis india drei neun,low,slow,Male
it-IT-GianniNeural,rangierfahrt von  vier zwei null  nach  alpha acht,medium,slow,Male
de-CH-JanNeural,umstellmanöver von  uniform sieben fünf  via papa acht nach  sechs zwei vier,medium,medium,Male
de-DE-KillianNeural,rangierfahrt vom  kilo sieben neun  ins  papa vier sieben,medium,slow,Male
de-DE-KasperNeural,umstellmanöver vom Gleis sierra eins  nach Gleis november sieben zwei,medium,medium,Male
de-CH-JanNeural,rangierfahrt vom  sechs eins fünf  nach  golf sieben,medium,slow,Male
de-DE-ConradNeural,rangierfahrt vom Gleis alpha drei  via vier sechs nach Gleis x-ray fünf,low,slow,Male
de-DE-RalfNeural,umstellmanöver von Gleis victor drei  nach Gleis zulu drei,medium,slow,Male
de-DE-RalfNeural,rangierfahrt vom Gleis lima neun  nach Gleis eins null neun,low,medium,Male
fr-FR-HenriNeural,rangierfahrt von Gleis vier fünf zwei  nach Gleis eins drei zwei,low,slow,Male
de-DE-ConradNeural,rangierfahrt von  delta sechs  via oscar zwei neun nach  oscar neun,low,slow,Male
de-DE-KillianNeural,umstellmanöver von  bravo eins  via uniform acht ins  kilo sechs,medium,medium,Male
de-DE-KillianNeural,rangierfahrt vom Gleis echo eins neun  nach Gleis victor sieben,medium,slow,Male
de-DE-KlausNeural,rangierfahrt von  x-ray zwei  nach  victor eins,low,medium,Male
de-DE-ConradNeural,rangierfahrt von  hotel fünf neun  nach  papa sieben eins,medium,slow,Male
de-AT-JonasNeural,umstellmanöver von  foxtrot eins  via tango fünf ins  tango sechs,low,medium,Male
de-DE-ConradNeural,rangierfahrt von Gleis zwei sechs  ins Gleis india sechs,medium,medium,Male
de-CH-JanNeural,rangierfahrt von Gleis oscar fünf sieben  nach Gleis quebec fünf,medium,slow,Male
fr-FR-HenriNeural,umstellmanöver vom Gleis acht neun zwei  via zulu acht zwei nach Gleis bravo eins sieben,low,medium,Male
de-DE-KasperNeural,rangierfahrt von  zwei fünf null  nach  victor neun,medium,slow,Male
de-AT-JonasNeural,rangierfahrt von Gleis zwei sieben drei  via hotel sechs nach Gleis romeo sieben,low,slow,Male
de-DE-ChristophNeural,rangierfahrt von Gleis acht drei neun  nach Gleis eins drei,low,slow,Male
de-AT-JonasNeural,rangierfahrt von  bravo acht sieben  via uniform eins fünf nach  lima vier sieben,low,slow,Male
it-IT-CalimeroNeural,umstellmanöver von  alpha vier  via charlie drei nach  zulu vier null,medium,medium,Male
de-DE-BerndNeural,rangierfahrt vom Gleis drei drei drei  via foxtrot drei nach Gleis tango sechs,low,slow,Male
de-DE-ChristophNeural,umstellmanöver von  papa neun  via eins null neun ins  alpha sieben,low,medium,Male
de-DE-RalfNeural,umstellmanöver von Gleis oscar acht drei  nach Gleis neun fünf sechs,medium,medium,Male
de-DE-KlausNeural,rangierfahrt von  charlie fünf sieben  ins  tango sieben,medium,slow,Male
de-AT-JonasNeural,umstellmanöver von Gleis romeo vier sieben  via papa sechs nach Gleis kilo sieben eins,medium,medium,Male
de-DE-KlausNeural,umstellmanöver von  zulu acht null  nach  golf sieben sechs,low,slow,Male
de-DE-ChristophNeural,umstellmanöver von  yankee vier  via kilo zwei nach  golf vier null,medium,medium,Male
de-DE-RalfNeural,rangierfahrt von Gleis november sieben  via zulu drei nach Gleis tango fünf zwei,low,medium,Male
de-DE-BerndNeural,rangierfahrt von  vier neun fünf  nach  whiskey fünf,medium,medium,Male
es-ES-EliasNeural,rangierfahrt von Gleis echo fünf drei  nach Gleis lima drei,medium,medium,Male
ar-EG-ShakirNeural,umstellmanöver vom Gleis kilo sieben  ins Gleis kilo drei eins,low,slow,Male
de-DE-KillianNeural,umstellmanöver von  eins fünf zwei  nach  fünf null null,medium,medium,Male
de-DE-BerndNeural,umstellmanöver von Gleis oscar fünf null  nach Gleis foxtrot zwei,medium,slow,Male
fr-FR-AlainNeural,umstellmanöver vom Gleis neun eins null  nach Gleis sieben vier drei,medium,slow,Male
de-DE-BerndNeural,rangierfahrt vom  yankee zwei acht  via juliett zwei nach  hotel zwei,medium,medium,Male
de-DE-ChristophNeural,umstellmanöver von Gleis india sieben  nach Gleis yankee eins,low,medium,Male
de-CH-JanNeural,umstellmanöver vom  drei  nach  india eins,low,slow,Male
de-DE-KlausNeural,umstellmanöver vom  drei acht acht  via eins neun fünf nach  delta vier fünf,medium,medium,Male
de-AT-JonasNeural,rangierfahrt vom  hotel neun  nach  oscar zwei fünf,low,slow,Male
fr-FR-YvesNeural,umstellmanöver von  drei drei vier  via lima vier drei nach  juliett sechs acht,medium,slow,Male
fr-FR-YvesNeural,umstellmanöver von Gleis tango drei null  via papa sechs null nach Gleis victor acht,low,medium,Male
de-DE-RalfNeural,umstellmanöver von Gleis zwei zwei zwei  via fünf sechs null nach Gleis sieben drei acht,medium,medium,Male
it-IT-LisandroNeural,umstellmanöver von Gleis foxtrot zwei  nach Gleis tango neun,low,slow,Male
de-DE-RalfNeural,umstellmanöver vom Gleis delta sechs sieben  via fünf vier sechs nach Gleis oscar eins eins,low,slow,Male
de-DE-KlausNeural,rangierfahrt von  mike vier  nach  vier zwei fünf,medium,medium,Male
it-IT-RinaldoNeural,rangierfahrt vom  vier zwei neun  ins  delta sieben,low,medium,Male
de-DE-ChristophNeural,umstellmanöver von  fünf vier zwei  via golf acht ins  mike neun,medium,medium,Male
de-DE-KillianNeural,umstellmanöver von Gleis kilo neun  via oscar vier nach Gleis quebec fünf zwei,medium,medium,Male
de-DE-ChristophNeural,umstellmanöver von Gleis echo vier  nach Gleis papa acht,medium,medium,Male
de-DE-ConradNeural,umstellmanöver von  charlie fünf  via mike neun sieben nach  zwei sechs vier,medium,medium,Male
de-DE-KlausNeural,rangierfahrt von  alpha neun  via zulu sechs vier ins  charlie neun fünf,medium,medium,Male
de-DE-KillianNeural,rangierfahrt vom  victor zwei null  ins  mike fünf zwei,low,slow,Male
ar-EG-ShakirNeural,umstellmanöver von  hotel eins  via fünf vier fünf nach  golf sechs acht,low,medium,Male
es-ES-TeoNeural,rangierfahrt von  victor vier  via victor fünf nach  alpha zwei fünf,low,slow,Male
it-IT-LisandroNeural,umstellmanöver vom  juliett sieben  ins  tango fünf neun,low,medium,Male
de-DE-KasperNeural,rangierfahrt von  delta zwei null  via quebec vier nach  hotel sechs,low,slow,Male
tr-TR-AhmetNeural,umstellmanöver vom Gleis india drei  nach Gleis victor fünf sechs,medium,slow,Male
de-DE-BerndNeural,umstellmanöver von Gleis golf fünf  ins Gleis whiskey sechs,medium,medium,Male
de-DE-RalfNeural,rangierfahrt von  fünf vier neun  nach  victor fünf,medium,medium,Male
de-DE-ChristophNeural,rangierfahrt von Gleis victor fünf fünf  nach Gleis delta zwei zwei,low,medium,Male
es-ES-SaulNeural,rangierfahrt von Gleis neun sechs  ins Gleis victor eins,low,medium,Male
de-CH-JanNeural,rangierfahrt von Gleis kilo zwei  via papa acht nach Gleis mike eins,medium,slow,Male
de-CH-JanNeural,rangierfahrt von Gleis drei fünf drei  via november sieben nach Gleis golf eins,low,medium,Male
de-CH-JanNeural,rangierfahrt von Gleis charlie neun zwei  via oscar eins nach Gleis papa vier,medium,medium,Male
de-DE-KlausNeural,rangierfahrt von Gleis golf neun sechs  nach Gleis oscar vier,medium,slow,Male
de-DE-RalfNeural,rangierfahrt vom  x-ray eins  via romeo zwei nach  quebec sechs,low,medium,Male
de-DE-ConradNeural,umstellmanöver vom Gleis uniform neun  via zwei acht null nach Gleis foxtrot sechs,low,medium,Male
de-DE-ConradNeural,rangierfahrt vom  victor sieben acht  nach  alpha sechs,medium,medium,Male
tr-TR-AhmetNeural,umstellmanöver von Gleis juliett sechs  via sierra neun vier nach Gleis sieben vier acht,low,medium,Male
de-DE-ConradNeural,umstellmanöver von Gleis hotel neun vier  ins Gleis papa drei fünf,low,slow,Male
de-DE-ChristophNeural,rangierfahrt von Gleis delta sechs  nach Gleis drei sechs fünf,medium,medium,Male
de-DE-ConradNeural,umstellmanöver vom Gleis lima drei  via drei zwei null ins Gleis neun zwei vier,medium,slow,Male
ta-IN-ValluvarNeural,rangierfahrt von Gleis whiskey drei  ins Gleis tango zwei,low,medium,Male
de-DE-KasperNeural,rangierfahrt von  fünf acht acht  via romeo drei nach  x-ray drei,low,slow,Male
de-CH-JanNeural,umstellmanöver von Gleis romeo zwei null  nach Gleis oscar sechs,medium,slow,Male
de-AT-JonasNeural,umstellmanöver von Gleis delta neun  ins Gleis golf acht,low,slow,Male
de-DE-RalfNeural,rangierfahrt von Gleis uniform neun  nach Gleis acht neun fünf,medium,slow,Male
de-DE-KasperNeural,rangierfahrt von  sieben neun fünf  nach  oscar sechs vier,low,slow,Male
de-DE-ChristophNeural,rangierfahrt von  hotel drei  nach  golf neun acht,low,medium,Male
de-DE-RalfNeural,umstellmanöver von Gleis bravo fünf zwei  via lima fünf ins Gleis uniform fünf null,low,medium,Male
de-DE-ConradNeural,rangierfahrt von  papa drei  ins  acht drei null,medium,slow,Male
de-AT-JonasNeural,umstellmanöver vom  x-ray vier  via zwei zwei null nach  bravo fünf,medium,slow,Male
de-DE-ChristophNeural,rangierfahrt von Gleis yankee vier eins  via yankee vier acht ins Gleis november drei,medium,slow,Male
de-DE-ChristophNeural,umstellmanöver von Gleis oscar neun  nach Gleis romeo zwei sechs,medium,medium,Male
ar-EG-ShakirNeural,rangierfahrt von Gleis echo sechs  nach Gleis juliett acht,low,medium,Male
it-IT-RinaldoNeural,umstellmanöver von Gleis quebec fünf  via tango zwei nach Gleis acht eins eins,low,slow,Male
de-AT-JonasNeural,umstellmanöver vom  lima acht  via golf zwei sechs nach  sechs sechs neun,medium,slow,Male
de-CH-JanNeural,umstellmanöver vom  whiskey drei sechs  via oscar zwei sechs ins  golf eins,low,slow,Male
de-DE-BerndNeural,umstellmanöver von  kilo eins zwei  via zwei neun null ins  quebec zwei,low,slow,Male
de-AT-JonasNeural,umstellmanöver von  sierra vier  nach  zulu neun,low,slow,Male
de-DE-RalfNeural,rangierfahrt vom  x-ray eins vier  via sechs zwei acht nach  x-ray sieben,medium,medium,Male
de-DE-ChristophNeural,umstellmanöver von  uniform sechs drei  via bravo sieben nach  tango zwei,medium,slow,Male
de-CH-JanNeural,rangierfahrt von  quebec sieben sieben  via tango vier nach  lima eins,low,slow,Male
de-DE-RalfNeural,rangierfahrt von Gleis neun drei  via vier acht nach Gleis sierra drei fünf,medium,slow,Male
de-DE-KlausNeural,rangierfahrt von  quebec fünf  nach  x-ray eins,low,medium,Male
de-DE-KlausNeural,rangierfahrt vom  vier neun acht  nach  november drei,low,slow,Male
de-DE-KlausNeural,umstellmanöver von  zulu zwei  via fünf neun sechs nach  kilo vier,medium,slow,Male
en-US-JacobNeural,rangierfahrt von Gleis tango drei eins  via foxtrot fünf nach Gleis acht drei eins,low,slow,Male
de-DE-RalfNeural,rangierfahrt von  tango sieben  nach  tango zwei eins,low,slow,Male
en-US-JasonNeural,rangierfahrt von  foxtrot drei  via bravo drei nach  alpha zwei drei,low,slow,Male
de-DE-BerndNeural,rangierfahrt vom  sierra sieben  nach  november eins,medium,slow,Male
de-DE-KillianNeural,rangierfahrt vom Gleis kilo sieben  ins Gleis romeo acht,medium,medium,Male
de-CH-JanNeural,umstellmanöver vom Gleis bravo sieben  nach Gleis charlie eins drei,medium,slow,Male
de-DE-KillianNeural,umstellmanöver von Gleis foxtrot sieben  via bravo fünf nach Gleis lima vier,low,medium,Male
de-DE-KillianNeural,rangierfahrt von  quebec fünf  via golf acht nach  sechs zwei acht,low,medium,Male
de-DE-ChristophNeural,umstellmanöver vom  victor drei sechs  via foxtrot neun eins ins  romeo fünf neun,medium,medium,Male
de-DE-KlausNeural,umstellmanöver von Gleis sierra zwei  nach Gleis whiskey drei,low,medium,Male
de-CH-JanNeural,umstellmanöver von Gleis uniform sieben  via foxtrot eins zwei nach Gleis mike vier,medium,slow,Male
it-IT-CalimeroNeural,umstellmanöver von  uniform acht  via zwei zwei eins nach  delta fünf sechs,low,slow,Male
de-DE-ConradNeural,rangierfahrt von Gleis whiskey sieben  via kilo fünf null nach Gleis vier eins eins,medium,medium,Male
de-DE-KillianNeural,rangierfahrt vom Gleis acht fünf drei  ins Gleis victor sieben,low,slow,Male
de-DE-KlausNeural,umstellmanöver vom  delta zwei acht  nach  romeo fünf null,low,slow,Male
es-ES-EliasNeural,umstellmanöver vom  neun null zwei  via delta fünf vier ins  mike vier,medium,medium,Male
de-DE-RalfNeural,umstellmanöver von  echo eins zwei  nach  delta vier,low,medium,Male
de-DE-KillianNeural,umstellmanöver vom  golf fünf  nach  acht eins drei,medium,medium,Male
de-DE-KasperNeural,rangierfahrt vom  fünf sieben drei  nach  drei sechs sieben,medium,medium,Male
de-DE-KlausNeural,umstellmanöver von Gleis golf acht vier  via acht neun sechs ins Gleis drei sieben null,low,slow,Male
de-DE-KillianNeural,rangierfahrt von Gleis neun sechs  ins Gleis victor eins,medium,medium,Male
de-DE-KillianNeural,rangierfahrt von Gleis bravo sieben  nach Gleis delta fünf,medium,slow,Male
de-DE-RalfNeural,umstellmanöver vom  oscar zwei  nach  india vier,medium,slow,Male
pt-PT-DuarteNeural,umstellmanöver von Gleis fünf neun eins  via victor acht nach Gleis sieben vier null,low,slow,Male
de-CH-JanNeural,rangierfahrt von  quebec neun  via india eins neun nach  alpha drei,medium,medium,Male
ar-EG-ShakirNeural,rangierfahrt von Gleis neun drei eins  via india fünf zwei nach Gleis mike fünf fünf,low,slow,Male
de-DE-ConradNeural,rangierfahrt von  romeo fünf sieben  via x-ray zwei nach  november neun null,low,slow,Male
de-DE-KillianNeural,umstellmanöver von Gleis alpha sechs  via whiskey acht nach Gleis november sieben,medium,medium,Male
de-DE-KlausNeural,rangierfahrt von  uniform drei  via whiskey acht nach  echo fünf,medium,slow,Male
de-DE-KasperNeural,rangierfahrt von  november sechs  via eins zwei acht ins  yankee vier,medium,medium,Male
de-DE-KlausNeural,rangierfahrt von Gleis delta zwei  via kilo neun neun nach Gleis november sechs,medium,medium,Male
tr-TR-AhmetNeural,umstellmanöver vom Gleis india sieben zwei  via romeo sieben nach Gleis victor drei null,low,slow,Male
de-CH-JanNeural,umstellmanöver vom  sechs sieben zwei  nach  uniform sieben,low,slow,Male
es-ES-NilNeural,umstellmanöver von  juliett drei  via mike acht ins  golf neun,medium,slow,Male
de-DE-KillianNeural,rangierfahrt von Gleis foxtrot vier  via neun vier sechs nach Gleis eins neun null,low,slow,Male
de-DE-BerndNeural,umstellmanöver von Gleis tango fünf  nach Gleis whiskey zwei,low,slow,Male
de-DE-RalfNeural,rangierfahrt von Gleis eins acht neun  via lima zwei vier nach Gleis sierra acht,low,slow,Male
de-DE-ChristophNeural,rangierfahrt von Gleis eins neun acht  ins Gleis foxtrot zwei zwei,medium,medium,Male
it-IT-BenignoNeural,umstellmanöver von Gleis vier neun null  ins Gleis kilo sechs,medium,medium,Male
en-US-EricNeural,umstellmanöver von Gleis vier eins zwei  via eins zwei acht nach Gleis juliett eins,medium,slow,Male
de-DE-ConradNeural,rangierfahrt vom  vier neun fünf  via echo sechs ins  bravo drei,medium,slow,Male
pt-PT-DuarteNeural,umstellmanöver von Gleis alpha sieben  nach Gleis tango vier sechs,medium,medium,Male
de-DE-ConradNeural,rangierfahrt von  hotel neun  via sieben neun null ins  alpha eins,medium,slow,Male
es-ES-AlvaroNeural,umstellmanöver von  delta vier  ins  juliett acht,medium,medium,Male
de-DE-KlausNeural,umstellmanöver von  romeo zwei  ins  romeo acht,low,medium,Male
ar-EG-ShakirNeural,rangierfahrt von  foxtrot sechs  nach  charlie drei,medium,medium,Male
de-DE-KlausNeural,rangierfahrt vom Gleis drei null null  ins Gleis yankee neun neun,medium,slow,Male
fr-FR-AlainNeural,rangierfahrt vom  tango vier vier  ins  delta drei zwei,medium,slow,Male
de-DE-KasperNeural,umstellmanöver vom Gleis sieben sieben drei  via foxtrot sieben nach Gleis fünf null zwei,low,medium,Male
fr-FR-HenriNeural,umstellmanöver von Gleis sieben neun fünf  via zulu fünf nach Gleis papa neun,low,medium,Male
de-DE-KillianNeural,rangierfahrt von Gleis echo sieben  nach Gleis juliett fünf,medium,slow,Male
tr-TR-AhmetNeural,umstellmanöver vom  charlie drei fünf  via zwei null null nach  quebec vier,medium,slow,Male
fr-FR-AlainNeural,rangierfahrt von  zulu drei  nach  mike eins,low,medium,Male
de-AT-JonasNeural,rangierfahrt von Gleis india sieben  nach Gleis sechs null vier,medium,medium,Male
fr-FR-JeromeNeural,rangierfahrt vom  india sechs  nach  acht vier fünf,low,slow,Male
it-IT-RinaldoNeural,rangierfahrt vom  hotel drei zwei  nach  eins drei fünf,low,medium,Male
de-AT-JonasNeural,rangierfahrt von  zulu eins fünf  nach  charlie neun,medium,slow,Male
de-DE-KlausNeural,umstellmanöver von Gleis drei drei vier  ins Gleis uniform eins,low,slow,Male
de-DE-RalfNeural,rangierfahrt von Gleis yankee drei  nach Gleis echo eins eins,low,slow,Male
de-DE-KlausNeural,umstellmanöver von Gleis mike eins  ins Gleis drei eins vier,low,slow,Male
de-AT-JonasNeural,umstellmanöver vom  delta eins  nach  november acht acht,low,medium,Male
it-IT-CalimeroNeural,rangierfahrt von Gleis quebec fünf neun  nach Gleis bravo vier,low,slow,Male
it-IT-DiegoNeural,rangierfahrt von  zulu sechs fünf  via victor neun null nach  delta eins drei,medium,slow,Male
de-AT-JonasNeural,umstellmanöver von  acht vier acht  nach  tango zwei,low,medium,Male
de-DE-ConradNeural,rangierfahrt von  foxtrot sieben  via sieben zwei eins nach  eins acht eins,medium,medium,Male
de-DE-KlausNeural,rangierfahrt von Gleis delta neun  via papa eins nach Gleis mike zwei,low,slow,Male
ta-IN-ValluvarNeural,umstellmanöver von Gleis x-ray vier  nach Gleis fünf null zwei,medium,medium,Male
en-US-EricNeural,umstellmanöver von  delta vier  via lima eins nach  quebec neun eins,low,slow,Male
de-CH-JanNeural,umstellmanöver von  hotel sieben fünf  nach  yankee sieben,low,medium,Male
de-DE-ChristophNeural,umstellmanöver vom  golf acht fünf  via romeo neun nach  romeo sieben zwei,medium,medium,Male
de-AT-JonasNeural,umstellmanöver von  november eins vier  ins  victor zwei,low,medium,Male
de-DE-KillianNeural,rangierfahrt von Gleis zwei sieben vier  via india eins eins nach Gleis acht null,medium,medium,Male
de-DE-ChristophNeural,umstellmanöver von Gleis vier eins sieben  ins Gleis india drei fünf,medium,slow,Male
de-CH-JanNeural,rangierfahrt vom Gleis romeo fünf sieben  via golf sieben nach Gleis romeo sieben,medium,slow,Male
de-DE-RalfNeural,umstellmanöver von  romeo eins  nach  vier sieben acht,low,slow,Male
de-DE-BerndNeural,rangierfahrt vom Gleis yankee fünf  via lima sechs nach Gleis kilo sieben null,medium,medium,Male
de-DE-BerndNeural,rangierfahrt vom Gleis sechs neun neun  via hotel acht drei nach Gleis neun null drei,medium,slow,Male
de-DE-KasperNeural,rangierfahrt von Gleis mike drei  via romeo sechs neun nach Gleis victor neun,medium,medium,Male
de-DE-KlausNeural,rangierfahrt vom Gleis acht eins neun  nach Gleis uniform acht,low,medium,Male
fr-FR-AlainNeural,umstellmanöver von  neun vier drei  via whiskey vier ins  yankee sieben,low,slow,Male
de-DE-KlausNeural,umstellmanöver von Gleis victor vier drei  via eins acht acht nach Gleis neun zwei sechs,low,slow,Male
pt-PT-DuarteNeural,rangierfahrt von  eins sieben eins  via tango zwei ins  november acht,low,medium,Male
de-CH-JanNeural,rangierfahrt vom  victor zwei sechs  nach  yankee acht,medium,slow,Male
it-IT-CalimeroNeural,umstellmanöver vom  drei fünf sieben  via foxtrot acht nach  sierra eins,medium,medium,Male
de-DE-KillianNeural,rangierfahrt vom Gleis fünf neun  nach Gleis vier vier fünf,medium,slow,Male
ta-IN-ValluvarNeural,rangierfahrt von Gleis sechs drei neun  via yankee drei sechs nach Gleis whiskey sechs drei,medium,slow,Male
fr-FR-JeromeNeural,umstellmanöver von Gleis tango sieben acht  via bravo vier nach Gleis kilo acht,low,slow,Male
de-DE-ChristophNeural,umstellmanöver von Gleis vier acht null  via romeo neun nach Gleis drei vier sechs,medium,medium,Male
pt-PT-DuarteNeural,rangierfahrt von Gleis juliett sieben  via delta neun nach Gleis vier zwei acht,low,medium,Male
de-AT-JonasNeural,umstellmanöver von Gleis papa neun zwei  via foxtrot zwei drei nach Gleis alpha sechs,low,slow,Male
it-IT-CalimeroNeural,rangierfahrt von Gleis charlie neun  via charlie vier zwei nach Gleis zwei vier zwei,medium,slow,Male
es-ES-AlvaroNeural,rangierfahrt von Gleis november fünf  via mike neun nach Gleis mike drei,low,slow,Male
de-DE-ConradNeural,rangierfahrt von Gleis lima zwei null  via november vier nach Gleis sieben vier fünf,low,medium,Male
de-CH-JanNeural,umstellmanöver von Gleis sechs acht sechs  via charlie fünf sechs nach Gleis yankee vier,medium,medium,Male
de-DE-ChristophNeural,rangierfahrt von  papa sieben  nach  zwei zwei acht,low,medium,Male
de-DE-KlausNeural,umstellmanöver von  alpha fünf  ins  oscar neun,medium,medium,Male
de-DE-ChristophNeural,umstellmanöver von  zulu zwei null  via tango sieben nach  echo eins,medium,slow,Male
de-DE-KlausNeural,umstellmanöver von  romeo acht  ins  delta eins sieben,low,slow,Male
tr-TR-AhmetNeural,umstellmanöver von Gleis quebec acht  via drei null eins nach Gleis sechs sechs vier,low,slow,Male
de-DE-RalfNeural,umstellmanöver von Gleis november drei  ins Gleis echo neun,low,medium,Male
fr-FR-MauriceNeural,umstellmanöver von  sieben neun vier  via echo sieben sieben nach  drei acht drei,low,medium,Male
de-DE-ChristophNeural,rangierfahrt von Gleis november acht  via bravo acht nach Gleis foxtrot sieben fünf,medium,slow,Male
de-CH-JanNeural,rangierfahrt von Gleis mike drei  via zulu zwei nach Gleis bravo acht,medium,slow,Male
de-CH-JanNeural,umstellmanöver von  x-ray sechs  via hotel sechs sechs ins  echo zwei,medium,medium,Male
de-DE-KillianNeural,rangierfahrt von  oscar fünf  nach  juliett eins,low,slow,Male
it-IT-BenignoNeural,umstellmanöver von Gleis hotel acht eins  nach Gleis tango drei,low,medium,Male
de-DE-KasperNeural,rangierfahrt von Gleis x-ray zwei null  nach Gleis oscar eins,low,slow,Male
de-DE-KillianNeural,rangierfahrt vom  delta drei  via juliett neun nach  yankee sieben,low,medium,Male
ar-EG-ShakirNeural,rangierfahrt von  zulu zwei  via quebec fünf nach  neun neun null,low,medium,Male
es-ES-NilNeural,rangierfahrt von  sechs drei vier  via neun vier null nach  fünf eins sieben,medium,medium,Male
it-IT-CalimeroNeural,umstellmanöver von  eins neun sechs  nach  india neun,low,slow,Male
de-DE-KillianNeural,rangierfahrt vom  echo acht  via kilo drei nach  bravo zwei null,low,medium,Male
de-DE-KlausNeural,rangierfahrt von Gleis drei drei eins  nach Gleis november eins vier,medium,medium,Male
de-DE-ChristophNeural,umstellmanöver von Gleis sierra fünf drei  via papa eins ins Gleis papa sieben,low,slow,Male
de-AT-JonasNeural,umstellmanöver von  x-ray fünf  nach  golf zwei,low,slow,Male
en-US-BrandonNeural,rangierfahrt von  eins acht null  nach  papa neun,low,medium,Male
de-DE-KasperNeural,umstellmanöver von  hotel eins sechs  via zwei zwei vier nach  neun sechs drei,low,medium,Male
de-DE-RalfNeural,rangierfahrt von  sechs fünf sieben  via sieben drei sechs ins  india drei,medium,slow,Male
de-DE-RalfNeural,rangierfahrt vom Gleis echo sieben  nach Gleis eins neun zwei,low,medium,Male
de-DE-ChristophNeural,rangierfahrt vom  eins eins neun  nach  yankee drei drei,low,medium,Male
de-DE-KillianNeural,rangierfahrt von Gleis tango zwei sechs  ins Gleis alpha drei,medium,medium,Male
fr-FR-JeromeNeural,umstellmanöver von Gleis fünf acht zwei  via alpha eins nach Gleis acht vier sieben,medium,medium,Male
fr-FR-MauriceNeural,umstellmanöver von  zulu acht  nach  papa fünf,low,medium,Male
de-DE-KillianNeural,umstellmanöver vom  delta sieben  nach  sieben drei acht,medium,medium,Male
de-DE-ConradNeural,umstellmanöver von Gleis acht vier sieben  via delta acht nach Gleis x-ray acht vier,low,slow,Male
tr-TR-AhmetNeural,umstellmanöver von Gleis mike drei  via fünf null fünf nach Gleis tango vier fünf,low,slow,Male
de-DE-KillianNeural,umstellmanöver von Gleis tango sechs  via mike drei drei nach Gleis sechs sieben sechs,low,medium,Male
de-DE-KasperNeural,umstellmanöver von  drei sechs  nach  lima eins,medium,medium,Male
es-ES-ArnauNeural,rangierfahrt von Gleis uniform zwei  ins Gleis alpha drei,medium,medium,Male
de-AT-JonasNeural,umstellmanöver von Gleis drei neun neun  nach Gleis vier,medium,slow,Male
de-DE-ChristophNeural,rangierfahrt von  acht eins fünf  nach  eins fünf sieben,low,medium,Male
ta-IN-ValluvarNeural,rangierfahrt von Gleis delta neun  nach Gleis tango sieben drei,low,slow,Male
de-DE-ChristophNeural,rangierfahrt von  quebec drei  via vier drei vier nach  eins zwei zwei,medium,medium,Male
tr-TR-AhmetNeural,umstellmanöver vom Gleis papa fünf acht  nach Gleis bravo eins fünf,medium,medium,Male
de-DE-KillianNeural,rangierfahrt von  whiskey sechs  via bravo sieben nach  lima neun fünf,medium,slow,Male
es-ES-DarioNeural,umstellmanöver von Gleis fünf eins zwei  via golf acht sieben nach Gleis fünf fünf,low,medium,Male
de-DE-BerndNeural,umstellmanöver vom Gleis sierra drei  nach Gleis echo drei,low,slow,Male
de-DE-RalfNeural,rangierfahrt vom Gleis uniform eins fünf  via eins eins acht nach Gleis juliett acht,medium,medium,Male
fr-FR-HenriNeural,umstellmanöver vom  kilo neun acht  ins  delta neun,low,slow,Male
de-DE-BerndNeural,umstellmanöver vom  golf fünf  nach  foxtrot vier,low,medium,Male
de-DE-ChristophNeural,rangierfahrt von  whiskey acht  via zwei vier vier ins  echo fünf drei,medium,slow,Male
de-DE-ConradNeural,umstellmanöver von  papa fünf  ins  sechs sechs neun,low,slow,Male
de-DE-KlausNeural,rangierfahrt von  sierra eins  via sechs drei eins nach  whiskey fünf,medium,slow,Male
