voice,text,pitch,rate,gender
de-DE-RalfNeural,rangierfahrt von Gleis drei eins sieben  nach Gleis mike zwei,low,slow,Male
fr-FR-AlainNeural,rangierfahrt von Gleis echo fünf null  nach Gleis neun acht sechs,medium,slow,Male
de-DE-ConradNeural,umstellmanöver vom  x-ray zwei sechs  via yankee sieben nach  mike fünf,low,slow,Male
ta-IN-ValluvarNeural,rangierfahrt vom  kilo sieben  ins  delta acht,low,slow,Male
pt-PT-DuarteNeural,umstellmanöver von  zulu acht  nach  juliett sieben,medium,medium,Male
de-DE-KlausNeural,rangierfahrt von  juliett neun null  via quebec neun neun nach  alpha zwei zwei,medium,slow,Male
ar-EG-ShakirNeural,umstellmanöver vom  romeo fünf  via charlie sechs nach  juliett acht,low,slow,Male
de-DE-KasperNeural,rangierfahrt von Gleis drei acht eins  nach Gleis hotel eins,medium,medium,Male
de-DE-ConradNeural,umstellmanöver von Gleis acht sechs acht  nach Gleis india sechs,low,medium,Male
de-DE-BerndNeural,rangierfahrt vom Gleis fünf fünf null  via foxtrot drei neun nach Gleis victor acht,low,slow,Male
de-DE-KlausNeural,umstellmanöver von  lima drei fünf  nach  hotel sieben neun,medium,medium,Male
de-AT-JonasNeural,umstellmanöver vom  papa fünf  nach  acht vier null,medium,medium,Male
de-AT-JonasNeural,umstellmanöver vom  zwei zwei vier  nach  vier drei drei,medium,slow,Male
ta-IN-ValluvarNeural,rangierfahrt vom  juliett zwei sieben  via drei null nach  kilo zwei,medium,slow,Male
fr-FR-AlainNeural,rangierfahrt vom  hotel drei sechs  nach  delta acht neun,low,medium,Male
ta-IN-ValluvarNeural,umstellmanöver von  papa neun  nach  juliett sechs,medium,medium,Male
ar-EG-ShakirNeural,umstellmanöver vom Gleis oscar zwei  via tango neun sechs nach Gleis sieben zwei acht,low,slow,Male
de-DE-KasperNeural,rangierfahrt von  uniform drei  via foxtrot sechs nach  kilo neun null,medium,slow,Male
fr-FR-JeromeNeural,rangierfahrt von  whiskey neun  nach  charlie fünf,low,medium,Male
de-DE-ChristophNeural,rangierfahrt vom  uniform vier  via whiskey eins nach  hotel sieben,medium,medium,Male
de-DE-ConradNeural,umstellmanöver von Gleis sierra fünf  via golf eins nach Gleis vier acht fünf,low,slow,Male
es-ES-DarioNeural,umstellmanöver vom Gleis delta zwei vier  nach Gleis papa sechs null,low,medium,Male
de-DE-RalfNeural,umstellmanöver von Gleis drei acht vier  nach Gleis mike fünf,low,medium,Male
de-DE-KasperNeural,umstellmanöver von Gleis neun acht zwei  nach Gleis echo eins,low,medium,Male
tr-TR-AhmetNeural,rangierfahrt von  zwei vier null  via delta neun nach  november fünf,low,slow,Male
fr-FR-AlainNeural,rangierfahrt von Gleis lima eins  ins Gleis foxtrot neun,low,medium,Male
de-DE-ConradNeural,rangierfahrt vom Gleis hotel drei  nach Gleis drei null null,medium,medium,Male
de-DE-BerndNeural,rangierfahrt vom Gleis zulu sechs  nach Gleis kilo sieben,low,medium,Male
fr-FR-AlainNeural,umstellmanöver vom  kilo acht eins  via eins vier fünf nach  zwei zwei neun,medium,medium,Male
de-DE-ChristophNeural,umstellmanöver von  papa sechs  via india drei sieben ins  romeo sieben zwei,low,medium,Male
de-DE-RalfNeural,umstellmanöver von  neun drei fünf  via bravo vier nach  oscar drei acht,low,slow,Male
de-DE-KasperNeural,rangierfahrt vom  whiskey fünf  nach  quebec fünf,low,slow,Male
de-DE-ChristophNeural,rangierfahrt vom  quebec eins  nach  delta acht,low,medium,Male
es-ES-SaulNeural,umstellmanöver vom  quebec eins zwei  nach  echo sechs fünf,low,slow,Male
fr-FR-ClaudeNeural,rangierfahrt vom Gleis kilo zwei null  via echo sieben sechs nach Gleis alpha fünf drei,medium,medium,Male
ta-IN-ValluvarNeural,umstellmanöver von Gleis oscar drei  nach Gleis victor fünf,low,slow,Male
fr-FR-JeromeNeural,umstellmanöver von Gleis acht sieben vier  via delta sechs nach Gleis delta acht,low,slow,Male
de-DE-ConradNeural,umstellmanöver von  india fünf  via tango sieben nach  romeo sieben,medium,medium,Male
de-DE-KillianNeural,umstellmanöver von  hotel neun  nach  mike eins,medium,slow,Male
de-CH-JanNeural,umstellmanöver von Gleis hotel sieben  via yankee fünf nach Gleis acht drei sechs,medium,medium,Male
de-DE-BerndNeural,umstellmanöver vom  drei sechs eins  nach  uniform drei,medium,medium,Male
de-DE-KlausNeural,umstellmanöver vom  victor drei  nach  charlie drei sechs,low,medium,Male
it-IT-DiegoNeural,umstellmanöver vom Gleis hotel sechs  nach Gleis india acht eins,medium,slow,Male
de-DE-KasperNeural,rangierfahrt vom Gleis lima vier  via eins sieben drei nach Gleis oscar sechs null,low,slow,Male
de-DE-RalfNeural,umstellmanöver von  echo neun drei  ins  tango vier,medium,slow,Male
de-AT-JonasNeural,umstellmanöver vom  hotel sieben acht  nach  delta fünf vier,medium,medium,Male
de-DE-KlausNeural,rangierfahrt von  echo eins  via zwei eins null nach  zwei vier eins,medium,slow,Male
de-DE-KillianNeural,umstellmanöver von  drei drei sechs  nach  golf zwei,low,medium,Male
de-AT-JonasNeural,rangierfahrt von  hotel sieben neun  nach  echo fünf,low,medium,Male
pt-PT-DuarteNeural,rangierfahrt von  tango zwei drei  via acht drei nach  eins acht fünf,low,slow,Male
de-CH-JanNeural,umstellmanöver von Gleis vier fünf fünf  via eins zwei drei nach Gleis alpha zwei neun,medium,slow,Male
fr-FR-AlainNeural,umstellmanöver von Gleis vier eins  nach Gleis kilo zwei neun,low,medium,Male
de-DE-KlausNeural,umstellmanöver von Gleis oscar acht  nach Gleis x-ray fünf,medium,medium,Male
de-DE-ConradNeural,umstellmanöver vom Gleis whiskey sechs sieben  nach Gleis victor drei,medium,slow,Male
de-DE-KillianNeural,umstellmanöver von Gleis sieben eins acht  via vier fünf sechs nach Gleis alpha vier,low,medium,Male
tr-TR-AhmetNeural,umstellmanöver von Gleis juliett eins  nach Gleis golf vier,medium,slow,Male
de-DE-KillianNeural,rangierfahrt von Gleis x-ray vier  via quebec acht nach Gleis papa neun drei,medium,slow,Male
de-CH-JanNeural,umstellmanöver vom  fünf neun neun  nach  charlie acht,low,medium,Male
fr-FR-YvesNeural,umstellmanöver von Gleis eins drei  via zulu drei nach Gleis alpha neun,low,medium,Male
it-IT-DiegoNeural,rangierfahrt von  victor sieben  ins  yankee sechs,medium,medium,Male
de-DE-KlausNeural,umstellmanöver von Gleis charlie vier acht  via zwei neun sieben ins Gleis uniform sieben acht,low,slow,Male
de-DE-ChristophNeural,rangierfahrt vom Gleis eins null fünf  via acht zwei eins nach Gleis november neun vier,medium,slow,Male
de-DE-ChristophNeural,rangierfahrt von  sechs sechs eins  nach  victor vier,medium,slow,Male
it-IT-DiegoNeural,rangierfahrt vom Gleis juliett eins  nach Gleis x-ray eins null,low,medium,Male
de-DE-ChristophNeural,rangierfahrt von  juliett zwei  via delta fünf vier nach  yankee sieben,medium,medium,Male
de-DE-KillianNeural,rangierfahrt von  foxtrot drei  via romeo neun ins  sechs null,medium,medium,Male
fr-FR-AlainNeural,rangierfahrt vom  echo vier vier  via bravo zwei nach  romeo drei,low,slow,Male
de-DE-KillianNeural,umstellmanöver von Gleis alpha neun sieben  ins Gleis delta sechs,medium,slow,Male
de-DE-ChristophNeural,umstellmanöver von  bravo vier  nach  oscar vier,medium,slow,Male
en-US-SteffanNeural,umstellmanöver von  juliett acht  via oscar vier null nach  juliett sieben,medium,slow,Male
fr-FR-AlainNeural,umstellmanöver von Gleis lima sechs  nach Gleis sechs fünf sieben,medium,medium,Male
de-DE-ChristophNeural,rangierfahrt von  charlie zwei  nach  november eins,low,medium,Male
de-DE-KasperNeural,umstellmanöver vom  lima fünf sechs  nach  eins fünf drei,medium,medium,Male
de-AT-JonasNeural,umstellmanöver von Gleis alpha neun neun  via quebec drei nach Gleis romeo acht,medium,medium,Male
de-DE-RalfNeural,rangierfahrt von Gleis delta neun  nach Gleis tango sieben drei,medium,slow,Male
de-DE-BerndNeural,umstellmanöver von  oscar eins  via vier zwei drei ins  zwei drei,medium,slow,Male
de-DE-ConradNeural,umstellmanöver von Gleis drei acht sieben  nach Gleis sieben fünf acht,low,slow,Male
de-CH-JanNeural,umstellmanöver von Gleis yankee drei fünf  nach Gleis sechs vier sechs,low,slow,Male
fr-FR-ClaudeNeural,rangierfahrt von  eins vier acht  ins  sechs eins drei,medium,slow,Male
de-AT-JonasNeural,umstellmanöver vom Gleis echo vier  nach Gleis x-ray zwei,medium,slow,Male
de-DE-BerndNeural,rangierfahrt vom  sierra acht  via november neun nach  romeo sechs,low,slow,Male
it-IT-GianniNeural,rangierfahrt von Gleis india acht  via foxtrot zwei nach Gleis charlie acht null,medium,medium,Male
fr-FR-MauriceNeural,umstellmanöver von Gleis mike sieben  nach Gleis zulu acht,low,slow,Male
de-DE-RalfNeural,umstellmanöver von Gleis neun zwei fünf  nach Gleis foxtrot sieben null,medium,slow,Male
de-DE-KillianNeural,umstellmanöver von Gleis tango acht  nach Gleis whiskey acht,low,medium,Male
de-DE-KasperNeural,rangierfahrt vom Gleis vier acht  nach Gleis neun eins null,low,medium,Male
de-AT-JonasNeural,rangierfahrt vom Gleis india vier  nach Gleis drei sechs neun,medium,medium,Male
fr-FR-YvesNeural,rangierfahrt von Gleis eins fünf sieben  ins Gleis x-ray vier,low,medium,Male
de-DE-ConradNeural,rangierfahrt vom  x-ray eins  via romeo zwei nach  quebec sechs,medium,medium,Male
en-US-JasonNeural,rangierfahrt vom  golf acht  via x-ray eins eins nach  acht zwei neun,medium,medium,Male
de-DE-KillianNeural,rangierfahrt von  november acht fünf  via zulu zwei drei nach  eins sechs acht,low,medium,Male
fr-FR-YvesNeural,umstellmanöver von  oscar sechs  ins  eins eins zwei,medium,medium,Male
ar-EG-ShakirNeural,umstellmanöver vom Gleis uniform vier  via acht eins fünf nach Gleis oscar sechs,low,medium,Male
de-DE-KlausNeural,rangierfahrt von  hotel drei  nach  golf zwei neun,medium,slow,Male
ar-EG-ShakirNeural,rangierfahrt von  alpha acht  via neun sechs acht ins  sechs eins acht,low,slow,Male
de-DE-BerndNeural,umstellmanöver vom  yankee acht  nach  romeo vier drei,medium,medium,Male
de-CH-JanNeural,umstellmanöver von  november drei fünf  via drei neun acht ins  sierra eins zwei,medium,medium,Male
de-DE-BerndNeural,rangierfahrt vom  foxtrot sechs  via drei zwei acht nach  fünf neun sechs,low,medium,Male
de-DE-KasperNeural,umstellmanöver von Gleis bravo neun  via juliett neun drei ins Gleis papa eins,low,slow,Male
fr-FR-HenriNeural,umstellmanöver von Gleis charlie zwei  via foxtrot drei nach Gleis vier zwei sechs,low,slow,Male
pt-PT-DuarteNeural,rangierfahrt von  sechs null eins  via drei sechs sieben nach  alpha neun acht,medium,slow,Male
ta-IN-ValluvarNeural,rangierfahrt von  november eins drei  via sieben sieben sieben nach  golf vier,medium,slow,Male
de-DE-BerndNeural,umstellmanöver von  zwei acht null  via quebec neun zwei ins  drei null vier,low,slow,Male
fr-FR-ClaudeNeural,rangierfahrt vom  papa sieben  nach  golf neun,medium,medium,Male
de-DE-KillianNeural,umstellmanöver von  eins drei eins  nach  quebec sieben,medium,slow,Male
en-US-RogerNeural,umstellmanöver von Gleis hotel drei fünf  via india drei nach Gleis drei sieben sieben,medium,slow,Male
it-IT-GianniNeural,umstellmanöver von Gleis sechs sieben drei  via neun drei eins nach Gleis yankee fünf,medium,slow,Male
fr-FR-MauriceNeural,rangierfahrt vom  hotel eins drei  nach  eins sechs fünf,low,slow,Male
tr-TR-AhmetNeural,rangierfahrt von  romeo zwei drei  via victor eins nach  victor sieben null,low,slow,Male
de-DE-KillianNeural,umstellmanöver vom Gleis quebec sieben drei  ins Gleis golf zwei vier,low,slow,Male
de-DE-ChristophNeural,rangierfahrt von  sieben eins eins  nach  lima sieben,medium,medium,Male
de-DE-BerndNeural,rangierfahrt von  victor acht sechs  via zulu drei nach  fünf drei,medium,slow,Male
de-DE-BerndNeural,rangierfahrt von  sechs neun zwei  ins  yankee acht neun,low,medium,Male
pt-PT-DuarteNeural,rangierfahrt vom Gleis neun sechs acht  nach Gleis sieben zwei,medium,slow,Male
tr-TR-AhmetNeural,umstellmanöver von  sierra eins sechs  via uniform neun sieben nach  juliett acht,medium,medium,Male
de-DE-KillianNeural,umstellmanöver von Gleis charlie neun  nach Gleis oscar vier,low,medium,Male
de-DE-RalfNeural,umstellmanöver von Gleis acht eins zwei  via lima vier nach Gleis echo vier,low,slow,Male
de-CH-JanNeural,rangierfahrt vom  sechs zwei neun  via fünf eins drei ins  oscar zwei,medium,slow,Male
fr-FR-JeromeNeural,rangierfahrt von  sierra neun vier  ins  hotel acht drei,low,medium,Male
en-US-JacobNeural,rangierfahrt von Gleis lima vier  nach Gleis hotel vier neun,low,slow,Male
de-DE-RalfNeural,umstellmanöver von Gleis oscar acht null  nach Gleis sierra fünf,medium,medium,Male
de-CH-JanNeural,umstellmanöver von Gleis x-ray drei  via eins zwei vier nach Gleis alpha zwei,medium,slow,Male
de-AT-JonasNeural,rangierfahrt von Gleis bravo drei  nach Gleis bravo drei null,low,medium,Male
it-IT-CalimeroNeural,umstellmanöver von  hotel zwei  nach  golf drei,medium,slow,Male
de-AT-JonasNeural,rangierfahrt von  oscar acht  via sieben nach  yankee sechs zwei,low,slow,Male
it-IT-GianniNeural,rangierfahrt von  lima sechs  nach  eins eins null,medium,medium,Male
de-DE-KasperNeural,umstellmanöver vom Gleis papa zwei  via sieben neun sieben nach Gleis eins null zwei,low,medium,Male
de-DE-ChristophNeural,rangierfahrt vom Gleis sierra eins  nach Gleis neun zwei vier,low,medium,Male
de-DE-RalfNeural,rangierfahrt vom  kilo eins  nach  zwei neun neun,medium,medium,Male
fr-FR-YvesNeural,rangierfahrt von Gleis lima neun zwei  via zwei neun nach Gleis eins vier sechs,medium,slow,Male
tr-TR-AhmetNeural,umstellmanöver von Gleis quebec zwei  nach Gleis acht fünf neun,low,slow,Male
de-DE-KasperNeural,rangierfahrt von Gleis delta vier  nach Gleis tango eins,medium,slow,Male
pt-PT-DuarteNeural,rangierfahrt von  oscar sieben  nach  tango eins,low,medium,Male
de-DE-KlausNeural,umstellmanöver von  sieben acht acht  nach  x-ray eins,low,slow,Male
de-DE-KillianNeural,umstellmanöver vom  whiskey vier  via romeo zwei vier nach  india acht,medium,medium,Male
de-DE-KasperNeural,rangierfahrt von Gleis sierra drei  via uniform drei nach Gleis juliett neun,low,slow,Male
fr-FR-MauriceNeural,rangierfahrt von Gleis quebec vier eins  via juliett fünf nach Gleis juliett zwei zwei,low,slow,Male
tr-TR-AhmetNeural,rangierfahrt von Gleis foxtrot eins acht  ins Gleis sierra drei,medium,slow,Male
fr-FR-HenriNeural,umstellmanöver vom  golf zwei fünf  via vier vier nach  foxtrot vier,medium,slow,Male
fr-FR-ClaudeNeural,rangierfahrt von  sieben zwei zwei  ins  echo zwei zwei,medium,medium,Male
de-DE-BerndNeural,rangierfahrt von Gleis juliett fünf acht  ins Gleis november sieben sechs,medium,slow,Male
fr-FR-ClaudeNeural,rangierfahrt von Gleis acht eins sechs  via golf fünf nach Gleis eins null fünf,medium,medium,Male
de-DE-ConradNeural,rangierfahrt von  whiskey zwei  via eins vier sieben nach  echo fünf null,low,slow,Male
fr-FR-JeromeNeural,umstellmanöver von Gleis golf sechs  nach Gleis quebec vier,low,slow,Male
de-DE-KasperNeural,umstellmanöver von Gleis quebec vier  via mike eins drei nach Gleis sechs drei vier,medium,slow,Male
de-DE-RalfNeural,umstellmanöver vom Gleis yankee vier sieben  via charlie neun nach Gleis bravo zwei,medium,medium,Male
es-ES-TeoNeural,rangierfahrt von  sieben drei fünf  via zwei neun zwei nach  mike sechs sieben,medium,medium,Male
en-US-TonyNeural,rangierfahrt von  sieben eins acht  nach  eins sieben acht,medium,slow,Male
de-DE-ConradNeural,rangierfahrt von  kilo vier  via kilo fünf nach  alpha fünf sechs,medium,slow,Male
de-DE-RalfNeural,rangierfahrt von  x-ray fünf  nach  zwei sieben neun,low,slow,Male
ta-IN-ValluvarNeural,rangierfahrt von Gleis hotel zwei drei  nach Gleis alpha vier,low,slow,Male
fr-FR-ClaudeNeural,rangierfahrt vom  november sieben null  nach  hotel sechs,low,slow,Male
en-US-DavisNeural,rangierfahrt von  victor eins  via foxtrot acht nach  drei drei null,low,medium,Male
de-DE-KillianNeural,rangierfahrt von  echo zwei zwei  nach  hotel sechs,low,slow,Male
de-DE-KillianNeural,umstellmanöver von  zwei fünf eins  via fünf eins sieben nach  zwei null acht,low,slow,Male
it-IT-GianniNeural,umstellmanöver von  vier drei sechs  via sierra acht acht ins  neun fünf neun,medium,medium,Male
de-DE-ConradNeural,umstellmanöver von  mike drei drei  ins  oscar sechs,medium,slow,Male
fr-FR-ClaudeNeural,rangierfahrt vom  tango fünf  nach  sierra acht,low,medium,Male
de-DE-BerndNeural,umstellmanöver von  neun vier drei  via whiskey vier ins  yankee sieben,medium,medium,Male
de-DE-KlausNeural,umstellmanöver von Gleis x-ray fünf  nach Gleis fünf zwei zwei,medium,slow,Male
tr-TR-AhmetNeural,rangierfahrt von  echo acht neun  via foxtrot drei nach  vier acht neun,low,medium,Male
de-DE-KlausNeural,umstellmanöver von Gleis sierra acht  ins Gleis x-ray drei,low,slow,Male
de-DE-KlausNeural,umstellmanöver vom  oscar sechs  nach  kilo neun,low,slow,Male
de-DE-ConradNeural,umstellmanöver vom Gleis juliett neun  ins Gleis juliett fünf,low,medium,Male
ar-EG-ShakirNeural,umstellmanöver von Gleis zwei eins null  via neun drei drei nach Gleis neun vier acht,medium,slow,Male
de-DE-KasperNeural,rangierfahrt von Gleis echo acht neun  nach Gleis x-ray drei fünf,medium,medium,Male
fr-FR-YvesNeural,umstellmanöver von  yankee drei null  ins  zwei sechs vier,medium,medium,Male
it-IT-LisandroNeural,rangierfahrt vom Gleis oscar sechs fünf  nach Gleis mike acht,low,slow,Male
de-AT-JonasNeural,rangierfahrt von  acht sechs eins  via acht fünf ins  drei fünf zwei,medium,medium,Male
it-IT-DiegoNeural,umstellmanöver vom  bravo drei drei  nach  vier vier neun,low,medium,Male
de-DE-RalfNeural,rangierfahrt von  zwei vier  nach  lima drei sieben,low,slow,Male
de-DE-RalfNeural,umstellmanöver von  golf vier  nach  zwei sieben vier,low,slow,Male
de-DE-BerndNeural,rangierfahrt von  lima fünf  via echo sieben nach  sierra neun,low,medium,Male
de-DE-KasperNeural,umstellmanöver vom  whiskey acht  via sierra zwei nach  charlie sieben,low,medium,Male
de-DE-RalfNeural,umstellmanöver von  acht sechs eins  via victor sechs nach  india sechs,medium,slow,Male
de-DE-KasperNeural,umstellmanöver von Gleis oscar eins sechs  nach Gleis alpha acht zwei,low,medium,Male
it-IT-GianniNeural,rangierfahrt von Gleis delta acht  nach Gleis whiskey sieben drei,low,slow,Male
de-AT-JonasNeural,umstellmanöver von Gleis papa zwei null  nach Gleis neun null eins,low,medium,Male
de-DE-RalfNeural,rangierfahrt vom  quebec fünf  nach  vier eins sechs,medium,medium,Male
fr-FR-AlainNeural,rangierfahrt von  oscar drei  via mike drei nach  hotel fünf,low,slow,Male
de-DE-KasperNeural,umstellmanöver von Gleis uniform fünf  via india drei nach Gleis vier vier fünf,low,slow,Male
de-DE-RalfNeural,rangierfahrt von  golf drei neun  nach  vier drei,medium,slow,Male
de-AT-JonasNeural,rangierfahrt von  fünf acht drei  via mike sieben nach  alpha drei,low,slow,Male
fr-FR-YvesNeural,rangierfahrt von Gleis eins vier  via vier null drei nach Gleis alpha eins,low,medium,Male
de-DE-ConradNeural,rangierfahrt vom  victor zwei  nach  foxtrot eins,medium,slow,Male
de-DE-KillianNeural,rangierfahrt von Gleis acht sieben null  ins Gleis india neun,low,slow,Male
it-IT-CataldoNeural,umstellmanöver von Gleis delta sechs vier  via echo sechs nach Gleis bravo drei,low,slow,Male
de-DE-KlausNeural,rangierfahrt vom  acht drei acht  ins  whiskey fünf,medium,medium,Male
es-ES-EliasNeural,umstellmanöver von  uniform neun  via eins acht zwei nach  drei zwei sieben,medium,medium,Male
de-DE-KasperNeural,umstellmanöver vom  zwei neun fünf  nach  quebec neun,medium,medium,Male
ta-IN-ValluvarNeural,umstellmanöver von  sierra sechs  via delta eins vier nach  mike zwei,low,slow,Male
de-DE-KillianNeural,rangierfahrt von  quebec eins eins  nach  neun eins vier,medium,medium,Male
de-AT-JonasNeural,rangierfahrt von Gleis kilo drei acht  via fünf acht sechs nach Gleis acht sechs sechs,low,slow,Male
de-DE-RalfNeural,rangierfahrt von Gleis sierra eins null  nach Gleis drei drei zwei,low,slow,Male
de-DE-ChristophNeural,rangierfahrt von Gleis quebec fünf  ins Gleis sechs vier acht,medium,medium,Male
fr-FR-HenriNeural,umstellmanöver von Gleis acht zwei null  nach Gleis golf sieben,low,slow,Male
fr-FR-ClaudeNeural,rangierfahrt vom  hotel acht sechs  nach  vier eins eins,low,slow,Male
ta-IN-ValluvarNeural,umstellmanöver vom Gleis eins fünf sieben  via november sechs nach Gleis romeo eins,medium,slow,Male
de-DE-RalfNeural,rangierfahrt von Gleis uniform sieben  via oscar zwei nach Gleis vier neun null,medium,medium,Male
it-IT-GianniNeural,umstellmanöver von  sierra zwei sechs  via eins zwei null nach  kilo sieben,medium,slow,Male
de-DE-ChristophNeural,rangierfahrt von Gleis golf fünf zwei  nach Gleis romeo sieben sechs,medium,slow,Male
de-DE-BerndNeural,umstellmanöver von Gleis hotel neun  nach Gleis charlie vier drei,low,slow,Male
it-IT-GianniNeural,rangierfahrt von  kilo sieben  via sechs sieben sieben ins  whiskey sieben,medium,slow,Male
de-DE-RalfNeural,umstellmanöver von Gleis sierra fünf  nach Gleis tango drei,medium,slow,Male
de-DE-KlausNeural,umstellmanöver von Gleis drei eins fünf  via delta fünf nach Gleis delta sechs sieben,medium,slow,Male
fr-FR-AlainNeural,rangierfahrt von  kilo acht  via india fünf vier ins  lima fünf acht,low,medium,Male
en-US-SteffanNeural,rangierfahrt von Gleis drei neun zwei  via lima fünf vier nach Gleis india sieben,low,slow,Male
de-DE-KlausNeural,rangierfahrt von Gleis neun null  via victor acht nach Gleis drei sechs eins,low,slow,Male
de-DE-ChristophNeural,umstellmanöver von  whiskey zwei  nach  drei sechs neun,medium,medium,Male
ta-IN-ValluvarNeural,umstellmanöver vom  victor drei sechs  via foxtrot neun eins ins  romeo fünf neun,medium,slow,Male
de-CH-JanNeural,rangierfahrt von  echo neun neun  via zwei sieben acht nach  x-ray neun,medium,medium,Male
de-DE-ChristophNeural,rangierfahrt vom  papa fünf  nach  drei null neun,low,medium,Male
de-DE-KlausNeural,umstellmanöver von Gleis sierra acht  via lima sieben nach Gleis delta neun zwei,low,medium,Male
it-IT-GianniNeural,umstellmanöver vom Gleis foxtrot sechs  nach Gleis golf drei,low,slow,Male
de-AT-JonasNeural,rangierfahrt vom  quebec neun  ins  golf neun vier,medium,slow,Male
de-AT-JonasNeural,umstellmanöver vom  sierra zwei null  via foxtrot zwei nach  sieben sieben acht,medium,slow,Male
de-DE-KasperNeural,rangierfahrt von Gleis lima fünf  nach Gleis zulu sieben,low,medium,Male
it-IT-CalimeroNeural,rangierfahrt von Gleis quebec zwei neun  via fünf fünf sieben nach Gleis romeo sieben,medium,slow,Male
de-DE-ConradNeural,umstellmanöver vom  uniform acht null  via lima eins sechs ins  sechs acht sieben,low,slow,Male
de-DE-RalfNeural,umstellmanöver von  drei  nach  neun sechs sechs,low,slow,Male
pt-PT-DuarteNeural,umstellmanöver vom  neun zwei drei  nach  drei null sechs,low,medium,Male
ta-IN-ValluvarNeural,umstellmanöver vom Gleis x-ray neun  via eins zwei nach Gleis kilo sieben,medium,slow,Male
de-CH-JanNeural,umstellmanöver von Gleis charlie drei  nach Gleis eins vier null,medium,medium,Male
de-DE-ChristophNeural,umstellmanöver von Gleis alpha sieben eins  nach Gleis victor acht,medium,medium,Male
de-DE-ConradNeural,umstellmanöver von  kilo acht eins  via echo sechs nach  fünf eins neun,medium,medium,Male
fr-FR-JeromeNeural,umstellmanöver von  uniform sieben  nach  mike sieben,medium,slow,Male
de-CH-JanNeural,umstellmanöver vom  echo acht  nach  bravo acht null,low,slow,Male
it-IT-RinaldoNeural,umstellmanöver vom  juliett neun  via bravo sieben nach  neun sechs fünf,medium,medium,Male
it-IT-DiegoNeural,umstellmanöver vom  whiskey sechs  via vier neun neun nach  sechs sieben vier,medium,slow,Male
ar-EG-ShakirNeural,umstellmanöver von  eins null null  nach  romeo sieben,low,slow,Male
de-DE-BerndNeural,rangierfahrt vom Gleis hotel acht  ins Gleis papa fünf,low,slow,Male
de-DE-KillianNeural,umstellmanöver von  sechs neun zwei  nach  delta neun acht,medium,medium,Male
tr-TR-AhmetNeural,rangierfahrt vom Gleis foxtrot drei drei  nach Gleis zwei sechs drei,low,slow,Male
es-ES-ArnauNeural,rangierfahrt vom Gleis sieben vier null  via foxtrot zwei ins Gleis echo neun acht,low,medium,Male
de-DE-ConradNeural,umstellmanöver vom  golf eins sechs  via delta eins nach  uniform neun,low,medium,Male
de-AT-JonasNeural,rangierfahrt von Gleis bravo zwei  ins Gleis sierra acht,low,medium,Male
en-US-JacobNeural,rangierfahrt vom  fünf eins drei  nach  november eins acht,medium,slow,Male
de-DE-ConradNeural,umstellmanöver von  uniform vier  via yankee drei nach  november vier,low,slow,Male
ar-EG-ShakirNeural,umstellmanöver von  november drei  via delta sechs nach  acht sechs acht,low,medium,Male
de-DE-BerndNeural,rangierfahrt vom  mike eins null  via zulu vier zwei nach  mike acht,medium,medium,Male
en-US-BrandonNeural,rangierfahrt von Gleis tango sechs  via whiskey vier nach Gleis romeo sechs,low,slow,Male
de-DE-ChristophNeural,umstellmanöver vom  victor zwei  via india vier fünf nach  eins fünf eins,medium,medium,Male
de-DE-KasperNeural,rangierfahrt von  tango acht vier  nach  romeo fünf acht,low,medium,Male
de-DE-ChristophNeural,umstellmanöver von Gleis oscar sechs  via quebec zwei nach Gleis india sechs,medium,slow,Male
de-DE-KasperNeural,rangierfahrt von Gleis india sechs  nach Gleis oscar fünf neun,medium,medium,Male
de-DE-KasperNeural,rangierfahrt von  whiskey sechs  nach  oscar vier,medium,slow,Male
de-DE-KlausNeural,umstellmanöver von  delta fünf  via x-ray neun neun nach  charlie acht,low,medium,Male
de-DE-KillianNeural,umstellmanöver von  x-ray eins acht  nach  uniform sechs,low,slow,Male
fr-FR-MauriceNeural,umstellmanöver von Gleis lima drei acht  nach Gleis papa fünf,medium,slow,Male
de-DE-KlausNeural,umstellmanöver von Gleis mike sechs  via hotel zwei nach Gleis kilo zwei,medium,slow,Male
